{
  "event_id": "7c95af4e-9bc6-4f7d-96f8-e22d80fc3d71",
  "event_type": "water.logged",
  "event_version": 1,
  "timestamp": "2026-03-31T10:00:00Z",
  "correlation_id": "7c95af4e-9bc6-4f7d-96f8-e22d80fc3d71",
  "payload": {
    "user_id": "user-001",
    "amount_ml": 250,
    "date_string": "2026-03-31"
  }
}
